title,summary,source,url,published_at,authors,overall_sentiment_score,overall_sentiment_label,ticker_sentiment_score,ticker_sentiment_label,ticker
Uber to invest over $100 million in autonomous vehicle charging amid robotaxi push,"Uber Technologies said on Wednesday it would invest more than $100 million to develop autonomous vehicle charging ‌hubs, underscoring the ride-hailing company's latest push to scale ‌up self-driving operations.  The move includes building DC fast charging stations at its autonomous depots ​where Uber runs day-to-day fleet operations, and at pit stops throughout priority cities.  Uber has made autonomous vehicles a key strategic priority, partnering with more than 20 firms across the world on self-driving freight, delivery ‌and taxi services, as ⁠it races to secure market share and fight competition from companies such as Tesla.",Yahoo Finance,https://finance.yahoo.com/news/uber-invest-over-100-million-120148324.html?.tsrc=rss,2026-02-18 12:01:48+00:00,,,,,,GOOGL
"Eric Schmidt Says 'We're Running Out Of Electricity,' Urges Space Data Centers — SpaceX CEO Elon Musk Quips: 'If Only There Were A Company'","Over the weekend, SpaceX CEO Elon Musk reacted to comments from former Google CEO Eric Schmidt, who warned the U.S. needs an additional 92 gigawatts of power to sustain artificial intelligence growth. AI Power Demand Surges As Grid Strains Musk shared a video clip of Schmidt saying, U.S. is ""running out of electricity."" He also noted that the average nuclear plant generates about 1.5 gigawatts. ""If only there were a company that could do this,"" Musk wrote on X while sharing the clip, referring t",Yahoo Finance,https://finance.yahoo.com/news/eric-schmidt-says-were-running-114525226.html?.tsrc=rss,2026-02-18 11:45:25+00:00,,,,,,GOOGL
"Social Buzz: Wallstreetbets Stocks Mostly Higher Premarket Wednesday; Amazon to Rise, Sandisk to Fall",The most-talked-about stocks in the Reddit subforum Wallstreetbets were mostly higher hours before W,Yahoo Finance,https://finance.yahoo.com/news/social-buzz-wallstreetbets-stocks-mostly-113450880.html?.tsrc=rss,2026-02-18 11:34:50+00:00,,,,,,GOOGL
Exclusive Thought Leadership Event TLFT 2026 Returns to New York City,"iResearch Services, a leading global B2B thought leadership agency, has announced the return of Thought Leadership for Tomorrow (TLFT) 2026, the premier invite-only event for senior decision-makers shaping the future of thought leadership. In its fourth-year running, and following the success of TLFT 2025, which convened over 100 industry leaders and 27 speakers from organizations including Google, Morgan Stanley, Salesforce, LinkedIn, IBM, KPMG, and Deloitte, the 2026 event promises an even mor",Yahoo Finance,https://finance.yahoo.com/news/exclusive-thought-leadership-event-tlft-112100019.html?.tsrc=rss,2026-02-18 11:21:00+00:00,,,,,,GOOGL
Nvidia Stock Rises After It Wins Meta Deal. Rival Broadcom’s Shares Slide.,Nvidia stock has flatlined amid the competitive threat from Broadcom and other chip makers. But Meta Platforms is committing to purchases with the chip maker.,Yahoo Finance,https://finance.yahoo.com/m/fb6287d6-0643-33ce-b7cf-60138c483fcf/nvidia-stock-rises-after-it.html?.tsrc=rss,2026-02-18 10:58:00+00:00,,,,,,GOOGL
Stock-Split Watch: Is Microsoft Next?,Its approximately $400-per-share price is close to where Apple split its stock in 2020.,Yahoo Finance,https://www.fool.com/investing/2026/02/18/stock-split-watch-is-microsoft-next/?.tsrc=rss,2026-02-18 10:50:00+00:00,,,,,,GOOGL
Google (GOOGL) Stock; Edges Lower Pre-I/O Amid Android XR and AI Teasers - CoinCentral,"<a href=""https://news.google.com/rss/articles/CBMiowFBVV95cUxNWGtITmdYYlpMSEwzVGgzS2psT1M3akhOeVg3dm1KRk43LTdKRFJnN1l2ZnlmOWdxMUV6bmdVRVlLQ0E2eVZlY1QxTklpQTZyRmVDQ2xCNkFoNnRUU0oyckZzOUQzWnY1OV9zMEFDU1FYdUtCVmtua3VYNGFGTTlmendBVmpLM2ViUUJRMVMxY0IwWElwNHJvMUFWdlBBSVlqY3Zr?oc=5"" target=""_blank"">Google (GOOGL) Stock; Edges Lower Pre-I/O Amid Android XR and AI Teasers</a>&nbsp;&nbsp;<font color=""#6f6f6f"">CoinCentral</font>",Google News,https://news.google.com/rss/articles/CBMiowFBVV95cUxNWGtITmdYYlpMSEwzVGgzS2psT1M3akhOeVg3dm1KRk43LTdKRFJnN1l2ZnlmOWdxMUV6bmdVRVlLQ0E2eVZlY1QxTklpQTZyRmVDQ2xCNkFoNnRUU0oyckZzOUQzWnY1OV9zMEFDU1FYdUtCVmtua3VYNGFGTTlmendBVmpLM2ViUUJRMVMxY0IwWElwNHJvMUFWdlBBSVlqY3Zr?oc=5,2026-02-18 09:44:07+00:00,,,,,,GOOGL
Meta's multibillion-dollar Nvidia deal sends a signal the chip giant's rivals can't ignore,"As AMD shares fell and Google's TPU ambitions stalled, Meta's commitment to Nvidia's full chip stack amounts to a strong vote of confidence that should (at least temporarily) settle investor nerves For Nvidia Corp (NASDAQ:NVDA, XETRA:NVD), the timing could hardly be better. After a rocky...",Yahoo Finance,https://www.proactiveinvestors.com/companies/news/1087539/meta-s-multibillion-dollar-nvidia-deal-sends-a-signal-the-chip-giant-s-rivals-can-t-ignore-1087539.html?.tsrc=rss,2026-02-18 08:30:00+00:00,,,,,,GOOGL
GOOGL: Alphabet Stock Bounces Off Double Bottom After 15% Slide. Time to Buy? - TradingView,"<a href=""https://news.google.com/rss/articles/CBMi0AFBVV95cUxNaFdnQ1pnaU9ueDA3M2d4UVVKYktkQ2ZUa3FIZUs5QWlQbFNuc0QySkVZQ3JiZEwzMGJQWDV0bkhzUDIwMzNrZENNVGtwZGpJV2JidHVCaUp5cG5SNzJzdWJLV1BnQVVlWmpwTUZ4NEFYVnpkb3BHbWpxQlRDcXg2R2tMSUQ3cXFvRG5lMkw0dkJCLTV3RXY0RV8yRDVDcVVfR2xMMEdaT1FBVGFVVzNFa1RVMGlFMHh1UFlLT21jRWxZZElwREV5NWJwOE5hbE5R?oc=5"" target=""_blank"">GOOGL: Alphabet Stock Bounces Off Double Bottom After 15% Slide. Time to Buy?</a>&nbsp;&nbsp;<font color=""#6f6f6f"">TradingView</font>",Google News,https://news.google.com/rss/articles/CBMi0AFBVV95cUxNaFdnQ1pnaU9ueDA3M2d4UVVKYktkQ2ZUa3FIZUs5QWlQbFNuc0QySkVZQ3JiZEwzMGJQWDV0bkhzUDIwMzNrZENNVGtwZGpJV2JidHVCaUp5cG5SNzJzdWJLV1BnQVVlWmpwTUZ4NEFYVnpkb3BHbWpxQlRDcXg2R2tMSUQ3cXFvRG5lMkw0dkJCLTV3RXY0RV8yRDVDcVVfR2xMMEdaT1FBVGFVVzNFa1RVMGlFMHh1UFlLT21jRWxZZElwREV5NWJwOE5hbE5R?oc=5,2026-02-18 07:49:00+00:00,,,,,,GOOGL
"Carrefour Aims to Boost Tech, Focus on Key Regions",The French retailer signed a partnership with AI company Vusion to digitize its hypermarkets and supermarkets in its home country.,Yahoo Finance,https://finance.yahoo.com/m/ab6b038a-775e-3129-bd60-a45c02a52d46/carrefour-aims-to-boost-tech%2C.html?.tsrc=rss,2026-02-18 07:19:00+00:00,,,,,,GOOGL
Warren Buffett Generated Double The Market's Returns—Until Regulation Changed The Game,"Social Capital founder Chamath Palihapitiya highlighted a striking pattern in Warren Buffett‘s investment performance, revealing how regulatory changes fundamentally altered returns for even the world’s best investors. Berkshire Hathaway’s Alpha Vanished After 2000 Regulatory Shift Speaking with Jason Calacanis on the All-In Podcast episode released Saturday, Palihapitiya shared data showing that Warren Buffett generated twice the market's returns before the implementation of Regulation Fair Dis",Yahoo Finance,https://finance.yahoo.com/news/warren-buffett-generated-double-markets-043109009.html?.tsrc=rss,2026-02-18 04:31:09+00:00,,,,,,GOOGL
H.C. Wainwright is Bullish on Hut 8 Corp. (HUT),"Hut 8 Corp. (NASDAQ:HUT) is among the 11 Best Bitcoin and Blockchain Stocks to Invest in. Hut 8 Corp. (NASDAQ:HUT) is among the Best Bitcoin Stocks. On February 2, H.C. Wainwright analyst Kevin Dede commenced coverage of Hut 8 Corp. (NASDAQ:HUT) while assigning it a Buy rating and a price target of $80. The analyst […]",Yahoo Finance,https://finance.yahoo.com/news/h-c-wainwright-bullish-hut-042759015.html?.tsrc=rss,2026-02-18 04:27:59+00:00,,,,,,GOOGL
"US Could Soon Enter A 'Debt Spiral', Exceeding Post-World War II Debt-To-GDP Record By 2030, Watchdog Says","The U.S. is approaching a critical fiscal point as its federal debt is projected to surpass historical levels, raising alarms about the country’s economic stability. What Is The CBO Saying? The U.S. federal debt is on track to surpass a significant milestone, with projections indicating a troubling fiscal future. The Congressional Budget Office (CBO) reports that publicly held debt stands at $31 trillion, equating to roughly 100% of the nation’s GDP. By 2030, the debt is expected to exceed the p",Yahoo Finance,https://finance.yahoo.com/news/us-could-soon-enter-debt-033030174.html?.tsrc=rss,2026-02-18 03:30:30+00:00,,,,,,GOOGL
Investors Dump Microsoft Shares Despite Largest Earnings Beat in Company History,"One of the biggest names in tech, Microsoft (NASDAQ:MSFT) shares have plunged below $400 despite delivering the largest earnings beat in company history, as investors question whether the company’s massive AI infrastructure spending will ever translate into profitable product adoption. The stock has plunged nearly a fifth this year as investors rotate away from AI ... Investors Dump Microsoft Shares Despite Largest Earnings Beat in Company History",Yahoo Finance,https://247wallst.com/investing/2026/02/17/investors-dump-microsoft-shares-despite-largest-earnings-beat-in-company-history/?.tsrc=rss,2026-02-18 03:24:33+00:00,,,,,,GOOGL
Alphabet director Hennessy sells $184k in GOOGL stock - Investing.com,"<a href=""https://news.google.com/rss/articles/CBMiuAFBVV95cUxQTldORE40a3FkOHRCNGNnQlBCdlVuZUNsRGtjWXJidV92NzdsSk5MSnAxMy1CZVZON2MzdUVKM0xGOGZTTzdjX2t1Q2o5Z1Zka3hWenZEQ3pVUkpyOW11aXp2ZE9TZ3FZYWxCSmM1RjQ0cGNTT0pQSHB0aUctR21oUG5JQXBTTUZNMVRYVG91aHhIaXgyQ0owbXNyaDk5Um44NnNZQWtCbjNZRFJKeWZTZk1UVUxiVjJw?oc=5"" target=""_blank"">Alphabet director Hennessy sells $184k in GOOGL stock</a>&nbsp;&nbsp;<font color=""#6f6f6f"">Investing.com</font>",Google News,https://news.google.com/rss/articles/CBMiuAFBVV95cUxQTldORE40a3FkOHRCNGNnQlBCdlVuZUNsRGtjWXJidV92NzdsSk5MSnAxMy1CZVZON2MzdUVKM0xGOGZTTzdjX2t1Q2o5Z1Zka3hWenZEQ3pVUkpyOW11aXp2ZE9TZ3FZYWxCSmM1RjQ0cGNTT0pQSHB0aUctR21oUG5JQXBTTUZNMVRYVG91aHhIaXgyQ0owbXNyaDk5Um44NnNZQWtCbjNZRFJKeWZTZk1UVUxiVjJw?oc=5,2026-02-18 02:29:21+00:00,,,,,,GOOGL
Land Grab for Data Centers Is One More Obstacle to Much-Needed Housing,"Resistance grows to more land sales in Northern Virginia. “They’d rather have homes than data,” said a former Prince William County supervisor.",Yahoo Finance,https://finance.yahoo.com/m/4ed10730-f76f-3791-8651-18697242dc9d/land-grab-for-data-centers-is.html?.tsrc=rss,2026-02-18 02:00:00+00:00,,,,,,GOOGL
Moonshot Targets $10 Billion Valuation After $500 Million Raise,Alibaba and Tencent back expanded round as Kimi K2.5 ranks among top-used AI models.,Yahoo Finance,https://finance.yahoo.com/news/moonshot-targets-10-billion-valuation-232853599.html?.tsrc=rss,2026-02-17 23:28:53+00:00,,,,,,GOOGL
Li Lu's Strategic Move: Significant Addition of Crocs Inc to Portfolio,"Exploring Li Lu (Trades, Portfolio)'s Investment Philosophy and Recent 13F Filing Insights",Yahoo Finance,https://finance.yahoo.com/news/li-lus-strategic-move-significant-231946752.html?.tsrc=rss,2026-02-17 23:19:46+00:00,,,,,,GOOGL
Alphabet Expands In India As Waymo Explores Hyundai Robotaxi Fleet Deal,"Alphabet (NasdaqGS: GOOGL) is planning a major expansion of its operations in India, with scope to more than double its local headcount as the country pushes for larger AI and cloud investments. Waymo, Alphabet’s autonomous driving unit, is reportedly working toward a partnership with Hyundai to add over 50,000 Ioniq 5 EVs to its robotaxi fleet. Together, these moves point to a larger physical footprint in a key growth market and a sizeable scale up in autonomous vehicle deployment...",Yahoo Finance,https://finance.yahoo.com/news/alphabet-expands-india-waymo-explores-231531840.html?.tsrc=rss,2026-02-17 23:15:31+00:00,,,,,,GOOGL
Bank of America resets Nvidia stock forecast,"Nvidia (NVDA) stock has gained about 32% over the past year, at the time of writing, Tuesday afternoon, Feb. 17, according to Yahoo Finance. Meanwhile, the SPDR S&amp;P 500 index (SPY) is up about 11% in the same period. It is impressive that Nvidia has outpaced the S&amp;P 500 by more than 20%, ...",Yahoo Finance,https://www.thestreet.com/investing/stocks/bank-of-america-resets-nvidia-stock-forecast?.tsrc=rss,2026-02-17 22:47:00+00:00,,,,,,GOOGL
"Berkshire Cuts Amazon Stake, Makes Bets on New York Times","Omaha, Nebraska-based Berkshire acquired 5.1 million shares of the media publishing company in the three months through December, a stake worth $351.7 million at yearend, according to a regulatory filing Tuesday.  Berkshire first bought a stake in Amazon in 2019.",Yahoo Finance,https://finance.yahoo.com/news/berkshire-cuts-amazon-stake-makes-223335538.html?.tsrc=rss,2026-02-17 22:33:35+00:00,,,,,,GOOGL
"Stock Market Today, Feb. 17: Apple Rebounds as AI Strategy Heads Into High-Profile March Event","Apple rebounded after a high-profile analyst reiterated confidence in its AI outlook, but attention now shifts to Siri upgrades and the March product event as investors look for clearer proof of AI-driven growth.",Yahoo Finance,https://www.fool.com/coverage/stock-market-today/2026/02/17/stock-market-today-feb-17-apple-rebounds-as-ai-strategy-heads-into-high-profile-march-event/?.tsrc=rss,2026-02-17 22:25:51+00:00,,,,,,GOOGL
Apple Stock Is Big Tech’s ’Safe Haven’,The fact that Apple hasn’t been spending nearly as much on AI as other megacap tech companies wasn’t always seen as a good thing.,Yahoo Finance,https://finance.yahoo.com/m/077287c5-20ab-346e-abb9-841e1fe00dc6/apple-stock-is-big-tech%E2%80%99s.html?.tsrc=rss,2026-02-17 22:12:00+00:00,,,,,,GOOGL
Analyst draws dot-com parallels to GOOGL’s 100-year bond - Investing.com,"<a href=""https://news.google.com/rss/articles/CBMirwFBVV95cUxPZnpGUkl3a2l0Ni04YTNGV2RORjdSR3BvVzAxMUQ0djVUb0ZhQjJSbE9ZU2FjTUhmVXQtLWFZc0p3ZnNVTnNydmxiR1hnTExVaFlrYm1zbnExOThCazZnNW1ZeElMMjZrUTdzNnIxeV9obW5wXzd0V2JLUm1Ca3Jvd3RVU1hrTlNSVEVyR2t1STQtc1JwZkh4Y3ozbWNBUWl4cm1OMDJDanZGdTFVZ2h3?oc=5"" target=""_blank"">Analyst draws dot-com parallels to GOOGL’s 100-year bond</a>&nbsp;&nbsp;<font color=""#6f6f6f"">Investing.com</font>",Google News,https://news.google.com/rss/articles/CBMirwFBVV95cUxPZnpGUkl3a2l0Ni04YTNGV2RORjdSR3BvVzAxMUQ0djVUb0ZhQjJSbE9ZU2FjTUhmVXQtLWFZc0p3ZnNVTnNydmxiR1hnTExVaFlrYm1zbnExOThCazZnNW1ZeElMMjZrUTdzNnIxeV9obW5wXzd0V2JLUm1Ca3Jvd3RVU1hrTlNSVEVyR2t1STQtc1JwZkh4Y3ozbWNBUWl4cm1OMDJDanZGdTFVZ2h3?oc=5,2026-02-17 21:42:06+00:00,,,,,,GOOGL
Nvidia and Meta expand GPU team up with millions of additional AI chips,Nvidia and Meta are expanding their chip deal to include millions of more AI processors.,Yahoo Finance (yfinance),https://finance.yahoo.com/news/nvidia-and-meta-expand-gpu-team-up-with-millions-of-additional-ai-chips-211544907.html,2026-02-17 21:15:44+00:00,,,,,,GOOGL
Beyond Tech Stocks: This Utility is Powering the Data Center Boom. - The Globe and Mail,"<a href=""https://news.google.com/rss/articles/CBMi5gFBVV95cUxORjFEdnR4TnF2N2lUdTBtdWhxVWVHTjkwSHNlY1VqZ25DY1AtWWRvckdpUWptaWdnSHlkRWMzTEtGZXNrQXljMU5mTDhDX2ZFdzI5cWlIdnBqREotQ2dCSzZDS2tucXFGSENjUWhRRHpWZWppLVJfZDJnMzdOSnhXWmVabncxc1J1OUtQbmE0VVpYckhqYjZvQXg3cG9RVTkwUDh2X05jc1UyOTY4LTdXb1hnNm9DTkNGTEVmY1lreUVyQVN6QmNIaEJnWjdlRnd6bTY3S0ZXUUlhVTFhWUFhSWcwRjJBQQ?oc=5"" target=""_blank"">Beyond Tech Stocks: This Utility is Powering the Data Center Boom.</a>&nbsp;&nbsp;<font color=""#6f6f6f"">The Globe and Mail</font>",Google News,https://news.google.com/rss/articles/CBMi5gFBVV95cUxORjFEdnR4TnF2N2lUdTBtdWhxVWVHTjkwSHNlY1VqZ25DY1AtWWRvckdpUWptaWdnSHlkRWMzTEtGZXNrQXljMU5mTDhDX2ZFdzI5cWlIdnBqREotQ2dCSzZDS2tucXFGSENjUWhRRHpWZWppLVJfZDJnMzdOSnhXWmVabncxc1J1OUtQbmE0VVpYckhqYjZvQXg3cG9RVTkwUDh2X05jc1UyOTY4LTdXb1hnNm9DTkNGTEVmY1lreUVyQVN6QmNIaEJnWjdlRnd6bTY3S0ZXUUlhVTFhWUFhSWcwRjJBQQ?oc=5,2026-02-17 19:42:44+00:00,,,,,,GOOGL
GOOGL.SW Alphabet (SIX) down 5.83% after hours: support near CHF240 - Meyka,"<a href=""https://news.google.com/rss/articles/CBMilAFBVV95cUxNZHNZZHdENUxyMV9jU0oyLU52THpBUHVCQ053Tnc1enFmaTR6bTFOWUdZYUVEdDNwUE96TExZcFlnRVVtYWJKWXZUYk41Z2RrOFUwVHB6eko2YVpPUWtPdFRMcU52Y2JpWnNjME1TMm1QajZuRGswZUZTLWxxNHMtOFhLOWEwNU9qc1ltMHpYM2I5eHEy?oc=5"" target=""_blank"">GOOGL.SW Alphabet (SIX) down 5.83% after hours: support near CHF240</a>&nbsp;&nbsp;<font color=""#6f6f6f"">Meyka</font>",Google News,https://news.google.com/rss/articles/CBMilAFBVV95cUxNZHNZZHdENUxyMV9jU0oyLU52THpBUHVCQ053Tnc1enFmaTR6bTFOWUdZYUVEdDNwUE96TExZcFlnRVVtYWJKWXZUYk41Z2RrOFUwVHB6eko2YVpPUWtPdFRMcU52Y2JpWnNjME1TMm1QajZuRGswZUZTLWxxNHMtOFhLOWEwNU9qc1ltMHpYM2I5eHEy?oc=5,2026-02-17 17:23:37+00:00,,,,,,GOOGL
"As This Hedge Fund Sells NVDA , GOOGL, and META, Here Is 1 Blue-Chip Stock It’s Loading Up On - Yahoo Finance","<a href=""https://news.google.com/rss/articles/CBMifkFVX3lxTE9PVmQ5dEppV2J4QjFsM3Nmdm9STFVwX0lHb2g5Z3NHbWM2dU0zWEZQSDYycHFuMWRVU0c2MmdGZlVHLUtLdHFkdHg3U3hKdGJ0WDItNW5mdU4xTW1scTJPU21MamRXQXYyTVlGZXQwUDJyZTg3ZmZjeVo2TzVtZw?oc=5"" target=""_blank"">As This Hedge Fund Sells NVDA , GOOGL, and META, Here Is 1 Blue-Chip Stock It’s Loading Up On</a>&nbsp;&nbsp;<font color=""#6f6f6f"">Yahoo Finance</font>",Google News,https://news.google.com/rss/articles/CBMifkFVX3lxTE9PVmQ5dEppV2J4QjFsM3Nmdm9STFVwX0lHb2g5Z3NHbWM2dU0zWEZQSDYycHFuMWRVU0c2MmdGZlVHLUtLdHFkdHg3U3hKdGJ0WDItNW5mdU4xTW1scTJPU21MamRXQXYyTVlGZXQwUDJyZTg3ZmZjeVo2TzVtZw?oc=5,2026-02-17 15:30:24+00:00,,,,,,GOOGL
"Investment Manager Sheds $10.6 Million VFC Shares, According to Recent SEC Filing - The Globe and Mail","<a href=""https://news.google.com/rss/articles/CBMi-gFBVV95cUxPMFJ2T3FNaFVQcDRhYUhCNm5Pb3hQdEVwdWV0aDBBZnJORUtuaXpaSzk5Zy1jRFBka3JGd1M3dDlrRXRJSi1jYXA0cW5yOGJyaF9PcTdQX2xkWm81SWZoVmhEMVU5eVBWd25GcTFLS1pBa0pqS29LN0dUakVEQjRYUkJRVXdvajdWNzNJeUI3Y0JtRjB2ZkVSMkxaSU52cFg3N0xZUEZ1REVlaS1jZ3liYmVnd29POHNkN2xOVW5EREpXaDEwTzhNTk9IZU9TMjhKMUtrWFUxVWduUV9NdDBhdlB0YlpOb3U5YVlYNzFsQ2ZCMVA5TjVhT053?oc=5"" target=""_blank"">Investment Manager Sheds $10.6 Million VFC Shares, According to Recent SEC Filing</a>&nbsp;&nbsp;<font color=""#6f6f6f"">The Globe and Mail</font>",Google News,https://news.google.com/rss/articles/CBMi-gFBVV95cUxPMFJ2T3FNaFVQcDRhYUhCNm5Pb3hQdEVwdWV0aDBBZnJORUtuaXpaSzk5Zy1jRFBka3JGd1M3dDlrRXRJSi1jYXA0cW5yOGJyaF9PcTdQX2xkWm81SWZoVmhEMVU5eVBWd25GcTFLS1pBa0pqS29LN0dUakVEQjRYUkJRVXdvajdWNzNJeUI3Y0JtRjB2ZkVSMkxaSU52cFg3N0xZUEZ1REVlaS1jZ3liYmVnd29POHNkN2xOVW5EREpXaDEwTzhNTk9IZU9TMjhKMUtrWFUxVWduUV9NdDBhdlB0YlpOb3U5YVlYNzFsQ2ZCMVA5TjVhT053?oc=5,2026-02-17 15:05:24+00:00,,,,,,GOOGL
Is GOOG Stock a Buy Amid the Software Selloff? - Barchart.com,"<a href=""https://news.google.com/rss/articles/CBMikgFBVV95cUxNOVJMcVVLSllENl8wcUtHdHVHS1Q2X3pIcnVDUWdycFBTSWFYc0g0ZTA5djBEbGo4dGlLUUdGSm54dHZuOTlYQ2RLaFB0aEZJWkdBSl8tUnJpY1NtNDZVc1lBd3R2SEM2eWk3dGI3YWV6bU9ReGhkVmxFQU9zSmNYd3YtOTc0MEtSNlBvTlBfRVZYUQ?oc=5"" target=""_blank"">Is GOOG Stock a Buy Amid the Software Selloff?</a>&nbsp;&nbsp;<font color=""#6f6f6f"">Barchart.com</font>",Google News,https://news.google.com/rss/articles/CBMikgFBVV95cUxNOVJMcVVLSllENl8wcUtHdHVHS1Q2X3pIcnVDUWdycFBTSWFYc0g0ZTA5djBEbGo4dGlLUUdGSm54dHZuOTlYQ2RLaFB0aEZJWkdBSl8tUnJpY1NtNDZVc1lBd3R2SEM2eWk3dGI3YWV6bU9ReGhkVmxFQU9zSmNYd3YtOTc0MEtSNlBvTlBfRVZYUQ?oc=5,2026-02-17 15:00:02+00:00,,,,,,GOOGL
Is Google Stock Ready For Another Rally? - Forbes,"<a href=""https://news.google.com/rss/articles/CBMinwFBVV95cUxOY2FLRlpMak5TbUZJd0lZY2VfVVNLeWJ3b0xwSHhpMFEtRC0wQV9RclRfa2lxcHBuazl6SXZzNzBEVGhaZG4tNGhKNnZGQnBDSTRIZWRKMGxheGc3WU5yTi1kWk1iWnNreXY4YTdHREJTelZMdmNLTHB4TU9GWVA3a013dmhuUXQ1dVJBcU5IMFBCS1IybE1TZHQ3TFBuTU0?oc=5"" target=""_blank"">Is Google Stock Ready For Another Rally?</a>&nbsp;&nbsp;<font color=""#6f6f6f"">Forbes</font>",Google News,https://news.google.com/rss/articles/CBMinwFBVV95cUxOY2FLRlpMak5TbUZJd0lZY2VfVVNLeWJ3b0xwSHhpMFEtRC0wQV9RclRfa2lxcHBuazl6SXZzNzBEVGhaZG4tNGhKNnZGQnBDSTRIZWRKMGxheGc3WU5yTi1kWk1iWnNreXY4YTdHREJTelZMdmNLTHB4TU9GWVA3a013dmhuUXQ1dVJBcU5IMFBCS1IybE1TZHQ3TFBuTU0?oc=5,2026-02-17 14:25:35+00:00,,,,,,GOOGL
Tech Futures Fall; Five Titans In Focus - Investor's Business Daily,"<a href=""https://news.google.com/rss/articles/CBMirAFBVV95cUxQc1duSGh3YUJ5Zms2X0FNby1IWmM0RjRudDZ2by1oVFE5R1d0YkxqU2toNVNZREpuRnNtbWtyb01VWTJUUXFMSjdQeHh4MGNSX2REeUxLQ0ZYUUFUMVV5d3ZEdnJqcFFCQmprQy0xbzdQRi1fVGZCenpYWGpCeEZYNWdtSHdXSDc0bVVvOXlRSkRWcnB4NFhSRklzQU9xYXhQNU9weUlWc3ZmRnRU?oc=5"" target=""_blank"">Tech Futures Fall; Five Titans In Focus</a>&nbsp;&nbsp;<font color=""#6f6f6f"">Investor's Business Daily</font>",Google News,https://news.google.com/rss/articles/CBMirAFBVV95cUxQc1duSGh3YUJ5Zms2X0FNby1IWmM0RjRudDZ2by1oVFE5R1d0YkxqU2toNVNZREpuRnNtbWtyb01VWTJUUXFMSjdQeHh4MGNSX2REeUxLQ0ZYUUFUMVV5d3ZEdnJqcFFCQmprQy0xbzdQRi1fVGZCenpYWGpCeEZYNWdtSHdXSDc0bVVvOXlRSkRWcnB4NFhSRklzQU9xYXhQNU9weUlWc3ZmRnRU?oc=5,2026-02-17 13:07:00+00:00,,,,,,GOOGL
Monness maintains neutral stance on Alphabet Inc. (GOOGL) stock - MSN,"<a href=""https://news.google.com/rss/articles/CBMi1wFBVV95cUxQODJrXzlLLXFESS01NnRlNVFTclE5X0dvWHBUc2ZvMThXaFhlbkZDRmtDUXBNQ0hVVEZEUXZYZXRKdHB2a3AwUjNBMW1pamx6NmxyWi1WNzJzMzZMMmdpUjdOT1p1OGdaX3ZJR0JlT29KQWw4UGZhTUU2SWw3X0VQcVJJWFd0dl9PdmlqSmc3YnhkWFN1ekRrcnNMUjRWa2l5UGtKT25LdjhBX1lWNTdQZVJJRlFZR1Q2MkV3NzdGYnBpNWUtNUwxeDg2QVgxaFJ1czVraTRLZw?oc=5"" target=""_blank"">Monness maintains neutral stance on Alphabet Inc. (GOOGL) stock</a>&nbsp;&nbsp;<font color=""#6f6f6f"">MSN</font>",Google News,https://news.google.com/rss/articles/CBMi1wFBVV95cUxQODJrXzlLLXFESS01NnRlNVFTclE5X0dvWHBUc2ZvMThXaFhlbkZDRmtDUXBNQ0hVVEZEUXZYZXRKdHB2a3AwUjNBMW1pamx6NmxyWi1WNzJzMzZMMmdpUjdOT1p1OGdaX3ZJR0JlT29KQWw4UGZhTUU2SWw3X0VQcVJJWFd0dl9PdmlqSmc3YnhkWFN1ekRrcnNMUjRWa2l5UGtKT25LdjhBX1lWNTdQZVJJRlFZR1Q2MkV3NzdGYnBpNWUtNUwxeDg2QVgxaFJ1czVraTRLZw?oc=5,2026-02-17 12:33:39+00:00,,,,,,GOOGL
Monness Maintains Neutral Stance on Alphabet Inc. (GOOGL) Stock - Yahoo Finance,"<a href=""https://news.google.com/rss/articles/CBMikAFBVV95cUxOMTViMDVzWnhRaU9RUkZxU1FIcWVILWtXZUxESkJvb1VWVDdjV1Zock1iU3JZRUc1cG1Edy1Hb1g0SW1DMmpmcFV6dzFTcGUzbDJpUU9qLXJ5Tm1OUmVQUjRwSzg0SVlxcVVvLWFITFJYRXVRQy1Xal9BWGYzby14MHAyd1ZnM0lqREdrcXpQWFM?oc=5"" target=""_blank"">Monness Maintains Neutral Stance on Alphabet Inc. (GOOGL) Stock</a>&nbsp;&nbsp;<font color=""#6f6f6f"">Yahoo Finance</font>",Google News,https://news.google.com/rss/articles/CBMikAFBVV95cUxOMTViMDVzWnhRaU9RUkZxU1FIcWVILWtXZUxESkJvb1VWVDdjV1Zock1iU3JZRUc1cG1Edy1Hb1g0SW1DMmpmcFV6dzFTcGUzbDJpUU9qLXJ5Tm1OUmVQUjRwSzg0SVlxcVVvLWFITFJYRXVRQy1Xal9BWGYzby14MHAyd1ZnM0lqREdrcXpQWFM?oc=5,2026-02-17 12:33:39+00:00,,,,,,GOOGL
GOOGL Stock Nears $300 as Alphabet Boosts Capital Spending - Eudaimonia and Co,"<a href=""https://news.google.com/rss/articles/CBMifkFVX3lxTE90R3lDNW9ISkxESHJFZm0ta3lTcU55bHdLUkh4QWZmWk1obVJNZGJoWGdYLU9hWUlBRVpWUmpMaU5xdktWU1k0TjAtdlhHbUpTcXhDNW1fQjRVQkVYdEtwMUtoMmNULUdFaGxaLUlVRWs1SWVmb2NsUUE2dG9hUQ?oc=5"" target=""_blank"">GOOGL Stock Nears $300 as Alphabet Boosts Capital Spending</a>&nbsp;&nbsp;<font color=""#6f6f6f"">Eudaimonia and Co</font>",Google News,https://news.google.com/rss/articles/CBMifkFVX3lxTE90R3lDNW9ISkxESHJFZm0ta3lTcU55bHdLUkh4QWZmWk1obVJNZGJoWGdYLU9hWUlBRVpWUmpMaU5xdktWU1k0TjAtdlhHbUpTcXhDNW1fQjRVQkVYdEtwMUtoMmNULUdFaGxaLUlVRWs1SWVmb2NsUUE2dG9hUQ?oc=5,2026-02-17 12:05:25+00:00,,,,,,GOOGL
Alphabet (GOOGL) Stock Gets Price Target Hikes from Wall Street After Strong Q4 Results - CoinCentral,"<a href=""https://news.google.com/rss/articles/CBMirwFBVV95cUxNaHVzYXNZalA0YlJnZURpUVJodzJXRWM5NjE4ZjZvT2Y1Rnl0OHRJcGg2X2M1TWg4SFRkRGk5SUNPS2xteFlBZXNOQjkzTHg4VzVaSkNJVGFDX094Q2RLSGdhYmdCZjN6M0RCcGhBNlBCRHlVejJObjhzNUNaaHNGU0R4M1d1bGJrUXdQMkJaS1NfbFN2X0FCaU9TWTdRbG9UYm1KamNTcm0xU1Nidi1Z?oc=5"" target=""_blank"">Alphabet (GOOGL) Stock Gets Price Target Hikes from Wall Street After Strong Q4 Results</a>&nbsp;&nbsp;<font color=""#6f6f6f"">CoinCentral</font>",Google News,https://news.google.com/rss/articles/CBMirwFBVV95cUxNaHVzYXNZalA0YlJnZURpUVJodzJXRWM5NjE4ZjZvT2Y1Rnl0OHRJcGg2X2M1TWg4SFRkRGk5SUNPS2xteFlBZXNOQjkzTHg4VzVaSkNJVGFDX094Q2RLSGdhYmdCZjN6M0RCcGhBNlBCRHlVejJObjhzNUNaaHNGU0R4M1d1bGJrUXdQMkJaS1NfbFN2X0FCaU9TWTdRbG9UYm1KamNTcm0xU1Nidi1Z?oc=5,2026-02-17 10:59:26+00:00,,,,,,GOOGL
3 Stocks to Double Up on Right Now - The Globe and Mail,"<a href=""https://news.google.com/rss/articles/CBMivgFBVV95cUxONjl6Y1VSYzNpczdZb0d3N0lQM19OSXRXRmthVjk0dmZoemRZV01EM1pHV1ZYM0xtb2JSN3hHenhKTUJsTHJsWDdISmF5dFlRZkdicnRUbEloa1daZHFaQ1BFaFZ4QWdkNm5jekJGNEJxVEM1RXpvUHd2X3ZBOVg0YkNCNV85QUtGdlFPcHI2TWRhdG9mZHlFRXlGOUlRZkpxSy1nOGJ1T2hPcHNLd0s3ZUZWek1IcjJuY3J4ZXhn?oc=5"" target=""_blank"">3 Stocks to Double Up on Right Now</a>&nbsp;&nbsp;<font color=""#6f6f6f"">The Globe and Mail</font>",Google News,https://news.google.com/rss/articles/CBMivgFBVV95cUxONjl6Y1VSYzNpczdZb0d3N0lQM19OSXRXRmthVjk0dmZoemRZV01EM1pHV1ZYM0xtb2JSN3hHenhKTUJsTHJsWDdISmF5dFlRZkdicnRUbEloa1daZHFaQ1BFaFZ4QWdkNm5jekJGNEJxVEM1RXpvUHd2X3ZBOVg0YkNCNV85QUtGdlFPcHI2TWRhdG9mZHlFRXlGOUlRZkpxSy1nOGJ1T2hPcHNLd0s3ZUZWek1IcjJuY3J4ZXhn?oc=5,2026-02-17 09:20:35+00:00,,,,,,GOOGL
Google GOOGL Stock Faces Key Test at $300 After Alphabet’s Massive Spending Plan - FXLeaders,"<a href=""https://news.google.com/rss/articles/CBMivgFBVV95cUxPRWVYRXlNeENyQU5Tdkh1Vi05ZnlwR0FtZThSQnBDaEV4enpoamRGZDh1YXI3LV82a3NkWXJNRlNTdkx2aEtLczJTUUNvaFQtQ3NySzlTWDl1ZVk3LURrNUg3YXRpNmlUeldjSU4wYWxsbFNwN3BGamNxbWpNVmFUNzNqRGVlMm5DM2htc2FMdXhGRTlUR3dnUDVoNU51RVZuQVZYSHpwak1pSU1WNkNSaGJod2JDNnVEakpSZjNR?oc=5"" target=""_blank"">Google GOOGL Stock Faces Key Test at $300 After Alphabet’s Massive Spending Plan</a>&nbsp;&nbsp;<font color=""#6f6f6f"">FXLeaders</font>",Google News,https://news.google.com/rss/articles/CBMivgFBVV95cUxPRWVYRXlNeENyQU5Tdkh1Vi05ZnlwR0FtZThSQnBDaEV4enpoamRGZDh1YXI3LV82a3NkWXJNRlNTdkx2aEtLczJTUUNvaFQtQ3NySzlTWDl1ZVk3LURrNUg3YXRpNmlUeldjSU4wYWxsbFNwN3BGamNxbWpNVmFUNzNqRGVlMm5DM2htc2FMdXhGRTlUR3dnUDVoNU51RVZuQVZYSHpwak1pSU1WNkNSaGJod2JDNnVEakpSZjNR?oc=5,2026-02-17 07:10:42+00:00,,,,,,GOOGL
